{
  "$schema": "./crabpot.ci-policy.schema.json",
  "version": 1,
  "allowedBlocked": [
    {
      "id": "voice-call-runtime-prerequisite",
      "seam": "registerGatewayMethod",
      "reasonIncludes": "captured voice-call method requires an enabled runtime and configured provider",
      "decision": "allowed-blocked",
      "until": "voice-call probes have an isolated enabled runtime and configured provider"
    },
    {
      "id": "voice-call-active-call-prerequisite",
      "seam": "registerGatewayMethod",
      "reasonIncludes": "captured voice-call action requires an active call and command input",
      "decision": "allowed-blocked",
      "until": "voice-call action probes can create isolated calls and supply command input"
    },
    {
      "id": "voice-call-steering-prerequisite",
      "seam": "registerGatewayMethod",
      "reasonIncludes": "captured voice-call steering requires an active realtime call, steering input, and authorized caller",
      "decision": "allowed-blocked",
      "until": "steering probes can create isolated realtime calls and supply the owning session or operator authority"
    },
    {
      "id": "voice-call-continuation-prerequisite",
      "seam": "registerGatewayMethod",
      "reasonIncludes": "captured voice-call continuation query requires an existing continuation operation",
      "decision": "allowed-blocked",
      "until": "voice-call continuation probes can create and poll isolated operations"
    },
    {
      "id": "matrix-verification-runtime-prerequisite",
      "seam": "registerGatewayMethod",
      "reasonIncludes": "captured Matrix verification requires a configured account and crypto runtime",
      "decision": "allowed-blocked",
      "until": "Matrix verification probes have an isolated configured account and crypto runtime"
    },
    {
      "id": "account-usage-runtime-prerequisite",
      "seam": "registerGatewayMethod",
      "reasonIncludes": "captured account usage requires a saved subscription login and Gateway runtime",
      "decision": "allowed-blocked",
      "until": "account usage probes have an isolated saved subscription login and Gateway runtime"
    },
    {
      "id": "meeting-transport-prerequisite",
      "seam": "registerGatewayMethod",
      "reasonIncludes": "captured meeting action requires a configured meeting and transport",
      "decision": "allowed-blocked",
      "until": "meeting probes have a configured meeting and isolated transport"
    },
    {
      "id": "meeting-creation-prerequisite",
      "seam": "registerGatewayMethod",
      "reasonIncludes": "captured room creation requires configured OAuth or a live browser transport",
      "decision": "allowed-blocked",
      "until": "room creation probes have an isolated OAuth or browser transport"
    },
    {
      "id": "meeting-session-prerequisite",
      "seam": "registerGatewayMethod",
      "reasonIncludes": "captured meeting action requires an active meeting session",
      "decision": "allowed-blocked",
      "until": "meeting session probes can create and tear down isolated session state"
    },
    {
      "id": "meeting-oauth-prerequisite",
      "seam": "registerGatewayMethod",
      "reasonIncludes": "captured meeting query requires Google Meet OAuth credentials",
      "decision": "allowed-blocked",
      "until": "meeting query probes have explicit isolated OAuth credentials"
    },
    {
      "id": "channel-runtime-harness",
      "seam": "registerChannel",
      "reasonIncludes": "includeChannelRuntime=true",
      "decision": "allowed-blocked",
      "until": "channel runtime harness lands"
    },
    {
      "id": "service-lifecycle-harness",
      "seam": "registerService",
      "reasonIncludes": "includeLifecycle=true",
      "decision": "allowed-blocked",
      "until": "service lifecycle harness lands"
    },
    {
      "id": "provider-capability-harness",
      "seam": "registerSpeechProvider",
      "reasonIncludes": "includeProviderCapabilities=true",
      "decision": "allowed-blocked",
      "until": "provider capability harness lands"
    },
    {
      "id": "live-network-tool-probes",
      "seam": "registerTool",
      "reasonIncludes": "live network access",
      "decision": "allowed-blocked",
      "until": "network-capability harness lands"
    },
    {
      "id": "generated-surface-hook-stubs",
      "seam": "*",
      "reasonIncludes": "captured hook has no callable handler",
      "decision": "allowed-blocked",
      "until": "generated surface runtime harness lands"
    },
    {
      "id": "generated-surface-registration-stubs",
      "seam": "*",
      "reasonIncludes": "captured registration has no supported callable probe",
      "decision": "allowed-blocked",
      "until": "generated surface runtime harness lands"
    },
    {
      "id": "http-route-descriptor-input",
      "seam": "registerHttpRoute",
      "reasonIncludes": "captured HTTP route probe requires route descriptor input",
      "decision": "allowed-blocked",
      "until": "HTTP route synthetic probes receive captured method/path descriptor input"
    },
    {
      "id": "memory-lancedb-tool-query-input",
      "seam": "registerTool",
      "reasonIncludes": "captured memory tool requires realistic query/text input",
      "decision": "allowed-blocked",
      "until": "memory tool argument synthesis supports realistic query payloads"
    },
    {
      "id": "memory-lancedb-host-embedding-runtime",
      "seam": "registerTool",
      "reasonIncludes": "captured memory tool requires the host embedding provider runtime",
      "decision": "allowed-blocked",
      "until": "memory synthetic probes can inject a host embedding runtime"
    },
    {
      "id": "transcript-source-provider-metadata",
      "seam": "registerTranscriptSourceProvider",
      "reasonIncludes": "captured registration has no execution profile",
      "decision": "allowed-blocked",
      "until": "transcript source provider synthetic probes can execute provider runtime hooks"
    },
    {
      "id": "clawrouter-endpoint-path-runtime",
      "seam": "registerTool",
      "reasonIncludes": "captured ClawRouter endpoint tool requires configured endpoint path input",
      "decision": "allowed-blocked",
      "until": "endpoint tool synthetic probes can inject configured path arguments"
    },
    {
      "id": "codex-app-server-conversation-binding-runtime",
      "seam": "onConversationBindingResolved",
      "reasonIncludes": "captured conversation-binding hook requires host conversation context",
      "decision": "allowed-blocked",
      "until": "conversation-binding synthetic probes can inject host conversation context"
    },
    {
      "id": "codex-app-server-interactive-payload-runtime",
      "seam": "registerInteractiveHandler",
      "reasonIncludes": "captured interactive handler requires host callback payload",
      "decision": "allowed-blocked",
      "until": "interactive-handler synthetic probes can inject callback payloads"
    },
    {
      "id": "codex-app-server-command-text-runtime",
      "seam": "registerCommand",
      "reasonIncludes": "captured command handler requires host command text",
      "decision": "allowed-blocked",
      "until": "command-handler synthetic probes can inject command text"
    },
    {
      "id": "discord-subagent-state-dir-runtime",
      "seam": "subagent_ended",
      "reasonIncludes": "captured Discord subagent hook requires the host state-dir runtime",
      "decision": "allowed-blocked",
      "until": "subagent hook synthetic probes can inject host state-dir runtime"
    },
    {
      "id": "memory-tencentdb-message-content-runtime",
      "seam": "before_message_write",
      "reasonIncludes": "captured memory write hook requires host message content",
      "decision": "allowed-blocked",
      "until": "memory write synthetic probes can inject host message content"
    }
  ],
  "expectedWarnings": [
    {
      "id": "tool-factory-descriptor",
      "seam": "registerTool",
      "reasonIncludes": "no object descriptor",
      "decision": "expected-warning",
      "until": "tool factory capture expansion lands"
    }
  ],
  "thresholds": {
    "wallP95RegressionPercent": 50,
    "peakRssRegressionMb": 50,
    "bootRegressionMs": 500,
    "strictMinimumSamples": 3
  },
  "fixtureSets": {
    "smoke": ["wecom", "llm-trace-phoenix", "codex-app-server", "opik-openclaw"],
    "openclaw-beta": [
      "brave-plugin",
      "codex",
      "diagnostics-prometheus",
      "google-meet",
      "diffs",
      "memory-lancedb",
      "whatsapp"
    ],
    "sdk-alias": ["codex-app-server"],
    "side-effect-review": ["hasdata", "llm-trace-phoenix", "web-search-plus"],
    "build": ["agentchat", "clawmetry", "opik-openclaw"]
  }
}
